drg,title,relative_weight,gmlos,sso
501,Soft tissue procedures w CC,0.8061,22.3,18.6
502,Soft tissue procedures w/o CC/MCC,0.8061,22.3,18.6
503,Foot procedures w MCC,1.0772,26.3,21.9
504,Foot procedures w CC,0.4545,15.4,12.8
505,Foot procedures w/o CC/MCC,0.4545,15.4,12.8
506,Major thumb or joint procedures,1.7328,37.2,31.0
507,Major shoulder or elbow joint procedures w CC/MCC,1.7328,37.2,31.0
508,Major shoulder or elbow joint procedures w/o CC/MCC,0.4545,15.4,12.8
509,Arthroscopy,0.4545,15.4,12.8
510,"Shoulder,elbow or forearm proc,exc major joint proc w MCC",0.4545,15.4,12.8
511,"Shoulder,elbow or forearm proc,exc major joint proc w CC",0.4545,15.4,12.8
512,"Shoulder,elbow or forearm proc,exc major joint proc w/o CC/MCC",0.4545,15.4,12.8
513,"Hand or wrist proc, except major thumb or joint proc w CC/MCC",1.7328,37.2,31.0
514,"Hand or wrist proc, except major thumb or joint proc w/o CC/MCC",0.4545,15.4,12.8
515,Other musculoskelet sys & conn tiss O.R. proc w MCC,1.5259,34.5,28.8
516,Other musculoskelet sys & conn tiss O.R. proc w CC,0.4545,15.4,12.8
517,Other musculoskelet sys & conn tiss O.R. proc w/o CC/MCC,0.4545,15.4,12.8
518,Back & neck proc exc spinal fusion w MCC or disc device/neurostim,1.7328,37.2,31.0
519,Back & neck proc exc spinal fusion w CC,0.6946,20.8,17.3
520,Back & neck proc exc spinal fusion w/o CC/MCC,0.4545,15.4,12.8
533,Fractures of femur w MCC,0.4545,15.4,12.8
534,Fractures of femur w/o MCC,0.4545,15.4,12.8
535,Fractures of hip & pelvis w MCC,1.0772,26.3,21.9
536,Fractures of hip & pelvis w/o MCC,0.609,19.1,15.9
537,"Sprains, strains, & dislocations of hip, pelvis & thigh w CC/MCC",0.4545,15.4,12.8
538,"Sprains, strains, & dislocations of hip, pelvis & thigh w/o CC/MCC",0.4545,15.4,12.8
539,Osteomyelitis w MCC,1.1007,29.1,24.3
540,Osteomyelitis w CC,0.8287,25.6,21.3
541,Osteomyelitis w/o CC/MCC,0.8061,22.3,18.6
542,Pathological fractures & musculoskelet & conn tiss malig w MCC,0.8061,22.3,18.6
543,Pathological fractures & musculoskelet & conn tiss malig w CC,0.4545,15.4,12.8
544,Pathological fractures & musculoskelet & conn tiss malig w/o CC/MCC,0.4545,15.4,12.8
545,Connective tissue disorders w MCC,1.0772,26.3,21.9
546,Connective tissue disorders w CC,0.4545,15.4,12.8
547,Connective tissue disorders w/o CC/MCC,0.4545,15.4,12.8
548,Septic arthritis w MCC,1.0746,26.5,22.1
549,Septic arthritis w CC,0.8061,22.3,18.6
550,Septic arthritis w/o CC/MCC,0.4545,15.4,12.8
551,Medical back problems w MCC,1.087,28.1,23.4
552,Medical back problems w/o MCC,0.609,19.1,15.9
553,Bone diseases & arthropathies w MCC,1.0772,26.3,21.9
554,Bone diseases & arthropathies w/o MCC,0.4545,15.4,12.8
555,Signs & symptoms of musculoskeletal system & conn tissue w MCC,0.609,19.1,15.9
556,Signs & symptoms of musculoskeletal system & conn tissue w/o MCC,0.609,19.1,15.9
557,"Tendonitis, myositis & bursitis w MCC",0.9448,25.8,21.5
558,"Tendonitis, myositis & bursitis w/o MCC",0.794,24.0,20.0
559,"Aftercare, musculoskeletal system & connective tissue w MCC",0.8971,24.2,20.2
560,"Aftercare, musculoskeletal system & connective tissue w CC",0.7153,23.4,19.5
561,"Aftercare, musculoskeletal system & connective tissue w/o CC/MCC",0.7153,23.4,19.5
562,"Fx, sprn, strn & disl except femur, hip, pelvis & thigh w MCC",1.0772,26.3,21.9
563,"Fx, sprn, strn & disl except femur, hip, pelvis & thigh w/o MCC",0.609,19.1,15.9
564,Other musculoskeletal sys & connective tissue diagnoses w MCC,0.931,24.1,20.1
565,Other musculoskeletal sys & connective tissue diagnoses w CC,0.6946,20.8,17.3
566,Other musculoskeletal sys & connective tissue diagnoses w/o CC/MCC,0.4545,15.4,12.8
570,Skin debridement w MCC,1.4196,35.3,29.4
571,Skin debridement w CC,0.9924,31.1,25.9
572,Skin debridement w/o CC/MCC,0.9924,31.1,25.9
573,Skin graft for skin ulcer or cellulitis w MCC,1.6854,45.1,37.6
574,Skin graft for skin ulcer or cellulitis w CC,1.4366,41.0,34.2
575,Skin graft for skin ulcer or cellulitis w/o CC/MCC,0.609,19.1,15.9
576,Skin graft exc for skin ulcer or cellulitis w MCC,1.7328,37.2,31.0
577,Skin graft exc for skin ulcer or cellulitis w CC,1.0772,26.3,21.9
578,Skin graft exc for skin ulcer or cellulitis w/o CC/MCC,0.609,19.1,15.9
579,"Other skin, subcut tiss & breast proc w MCC",1.2473,30.7,25.6
580,"Other skin, subcut tiss & breast proc w CC",1.1176,31.8,26.5
581,"Other skin, subcut tiss & breast proc w/o CC/MCC",0.609,19.1,15.9
582,Mastectomy for malignancy w CC/MCC,0.9924,31.1,25.9
583,Mastectomy for malignancy w/o CC/MCC,0.609,19.1,15.9
584,"Breast biopsy, local excision & other breast procedures w CC/MCC",0.9924,31.1,25.9
585,"Breast biopsy, local excision & other breast procedures w/o CC/MCC",0.609,19.1,15.9
592,Skin ulcers w MCC,0.9504,25.0,20.8
593,Skin ulcers w CC,0.7396,24.3,20.3
594,Skin ulcers w/o CC/MCC,0.609,19.1,15.9
595,Major skin disorders w MCC,0.8061,22.3,18.6
596,Major skin disorders w/o MCC,0.4545,15.4,12.8
597,Malignant breast disorders w MCC,0.609,19.1,15.9
598,Malignant breast disorders w CC,0.609,19.1,15.9
599,Malignant breast disorders w/o CC/MCC,0.4545,15.4,12.8
600,Non-malignant breast disorders w CC/MCC,0.8061,22.3,18.6
601,Non-malignant breast disorders w/o CC/MCC,0.4545,15.4,12.8
602,Cellulitis w MCC,0.7995,22.3,18.6
603,Cellulitis w/o MCC,0.5315,18.1,15.1
604,"Trauma to the skin, subcut tiss & breast w MCC",0.8904,25.1,20.9
605,"Trauma to the skin, subcut tiss & breast w/o MCC",0.8061,22.3,18.6
606,Minor skin disorders w MCC,1.2021,24.9,20.8
607,Minor skin disorders w/o MCC,0.609,19.1,15.9
614,Adrenal & pituitary procedures w CC/MCC,0.8061,22.3,18.6
615,Adrenal & pituitary procedures w/o CC/MCC,0.4545,15.4,12.8
616,"Amputat of lower limb for endocrine,nutrit,& metabol dis w MCC",1.4208,35.0,29.2
617,"Amputat of lower limb for endocrine,nutrit,& metabol dis w CC",1.4208,35.0,29.2
618,"Amputat of lower limb for endocrine,nutrit,& metabol dis w/o CC/MCC",1.0772,26.3,21.9
619,O.R. procedures for obesity w MCC,1.538,34.2,28.5
620,O.R. procedures for obesity w CC,1.0772,26.3,21.9
621,O.R. procedures for obesity w/o CC/MCC,0.8061,22.3,18.6
622,"Skin grafts & wound debrid for endoc, nutrit & metab dis w MCC",1.533,33.9,28.3
623,"Skin grafts & wound debrid for endoc, nutrit & metab dis w CC",1.0596,29.0,24.2
624,"Skin grafts & wound debrid for endoc, nutrit & metab dis w/o CC/MCC",0.609,19.1,15.9
625,"Thyroid, parathyroid & thyroglossal procedures w MCC",1.7169,35.1,29.3
626,"Thyroid, parathyroid & thyroglossal procedures w CC",1.0772,26.3,21.9
627,"Thyroid, parathyroid & thyroglossal procedures w/o CC/MCC",0.609,19.1,15.9
628,"Other endocrine, nutrit & metab O.R. proc w MCC",1.7169,35.1,29.3
629,"Other endocrine, nutrit & metab O.R. proc w CC",1.0772,26.3,21.9
630,"Other endocrine, nutrit & metab O.R. proc w/o CC/MCC",0.609,19.1,15.9
637,Diabetes w MCC,1.0313,26.2,21.8
638,Diabetes w CC,0.8198,23.8,19.8
639,Diabetes w/o CC/MCC,0.4545,15.4,12.8
640,"Misc disorders of nutrition,metabolism,fluids/electrolytes w MCC",0.9733,23.9,19.9
641,"Misc disorders of nutrition,metabolism,fluids/electrolytes w/o MCC",0.6731,19.6,16.3
642,Inborn and other disorders of metabolism,1.0772,26.3,21.9
643,Endocrine disorders w MCC,0.8061,22.3,18.6
644,Endocrine disorders w CC,0.8061,22.3,18.6
645,Endocrine disorders w/o CC/MCC,0.4545,15.4,12.8
652,Kidney transplant,0.0,0.0,0.0
653,Major bladder procedures w MCC,1.7328,37.2,31.0
654,Major bladder procedures w CC,1.0772,26.3,21.9
655,Major bladder procedures w/o CC/MCC,0.8061,22.3,18.6
656,Kidney & ureter procedures for neoplasm w MCC,1.0772,26.3,21.9
657,Kidney & ureter procedures for neoplasm w CC,0.8061,22.3,18.6
658,Kidney & ureter procedures for neoplasm w/o CC/MCC,0.8061,22.3,18.6
659,Kidney & ureter procedures for non-neoplasm w MCC,1.0772,26.3,21.9
660,Kidney & ureter procedures for non-neoplasm w CC,1.0772,26.3,21.9
661,Kidney & ureter procedures for non-neoplasm w/o CC/MCC,0.8061,22.3,18.6
662,Minor bladder procedures w MCC,1.0772,26.3,21.9
663,Minor bladder procedures w CC,0.8061,22.3,18.6
664,Minor bladder procedures w/o CC/MCC,0.8061,22.3,18.6
665,Prostatectomy w MCC,1.0772,26.3,21.9
666,Prostatectomy w CC,1.0772,26.3,21.9
667,Prostatectomy w/o CC/MCC,0.8061,22.3,18.6
668,Transurethral procedures w MCC,1.7328,37.2,31.0
669,Transurethral procedures w CC,1.7328,37.2,31.0
670,Transurethral procedures w/o CC/MCC,0.72,20.3,16.9
671,Urethral procedures w CC/MCC,0.72,20.3,16.9
672,Urethral procedures w/o CC/MCC,0.72,20.3,16.9
673,Other kidney & urinary tract procedures w MCC,1.4987,33.0,27.5
674,Other kidney & urinary tract procedures w CC,1.4987,33.0,27.5
675,Other kidney & urinary tract procedures w/o CC/MCC,0.72,20.3,16.9
682,Renal failure w MCC,0.9542,23.2,19.3
683,Renal failure w CC,0.72,20.3,16.9
684,Renal failure w/o CC/MCC,0.72,20.3,16.9
686,Kidney & urinary tract neoplasms w MCC,1.7328,37.2,31.0
687,Kidney & urinary tract neoplasms w CC,1.0772,26.3,21.9
688,Kidney & urinary tract neoplasms w/o CC/MCC,0.6854,20.9,17.4
689,Kidney & urinary tract infections w MCC,0.6954,20.6,17.2
690,Kidney & urinary tract infections w/o MCC,0.4969,17.3,14.4
691,Urinary stones w esw lithotripsy w CC/MCC,0.609,19.1,15.9
692,Urinary stones w esw lithotripsy w/o CC/MCC,0.4545,15.4,12.8
693,Urinary stones w/o esw lithotripsy w MCC,0.4545,15.4,12.8
694,Urinary stones w/o esw lithotripsy w/o MCC,0.4545,15.4,12.8
695,Kidney & urinary tract signs & symptoms w MCC,0.4545,15.4,12.8
696,Kidney & urinary tract signs & symptoms w/o MCC,0.4545,15.4,12.8
697,Urethral stricture,0.8947,22.6,18.8
698,Other kidney & urinary tract diagnoses w MCC,0.8947,22.6,18.8
699,Other kidney & urinary tract diagnoses w CC,0.6854,20.9,17.4
700,Other kidney & urinary tract diagnoses w/o CC/MCC,0.6854,20.9,17.4
707,Major male pelvic procedures w CC/MCC,1.4987,33.0,27.5
708,Major male pelvic procedures w/o CC/MCC,1.4987,33.0,27.5
709,Penis procedures w CC/MCC,1.0772,26.3,21.9
710,Penis procedures w/o CC/MCC,0.6854,20.9,17.4
711,Testes procedures w CC/MCC,1.0772,26.3,21.9
712,Testes procedures w/o CC/MCC,0.72,20.3,16.9
713,Transurethral prostatectomy w CC/MCC,1.7328,37.2,31.0
714,Transurethral prostatectomy w/o CC/MCC,1.7328,37.2,31.0
715,Other male reproductive system O.R. proc for malignancy w CC/MCC,0.72,20.3,16.9
716,Other male reproductive system O.R. proc for malignancy w/o CC/MCC,0.72,20.3,16.9
717,Other male reproductive system O.R. proc exc malignancy w CC/MCC,1.1355,28.7,23.9
718,Other male reproductive system O.R. proc exc malignancy w/o CC/MCC,0.72,20.3,16.9
722,"Malignancy, male reproductive system w MCC",0.8061,22.3,18.6
723,"Malignancy, male reproductive system w CC",0.8061,22.3,18.6
724,"Malignancy, male reproductive system w/o CC/MCC",0.4545,15.4,12.8
725,Benign prostatic hypertrophy w MCC,0.4545,15.4,12.8
726,Benign prostatic hypertrophy w/o MCC,0.4545,15.4,12.8
727,Inflammation of the male reproductive system w MCC,0.7366,22.8,19.0
728,Inflammation of the male reproductive system w/o MCC,0.5511,20.3,16.9
729,Other male reproductive system diagnoses w CC/MCC,1.0772,26.3,21.9
730,Other male reproductive system diagnoses w/o CC/MCC,0.72,20.3,16.9
734,"Pelvic evisceration, rad hysterectomy & rad vulvectomy w CC/MCC",1.0772,26.3,21.9
735,"Pelvic evisceration, rad hysterectomy & rad vulvectomy w/o CC/MCC",1.0772,26.3,21.9
736,Uterine & adnexa proc for ovarian or adnexal malignancy w MCC,1.0772,26.3,21.9
737,Uterine & adnexa proc for ovarian or adnexal malignancy w CC,1.0772,26.3,21.9
738,Uterine & adnexa proc for ovarian or adnexal malignancy w/o CC/MCC,1.0772,26.3,21.9
739,"Uterine,adnexa proc for non-ovarian/adnexal malig w MCC",1.7169,35.1,29.3
740,"Uterine,adnexa proc for non-ovarian/adnexal malig w CC",1.0772,26.3,21.9
741,"Uterine,adnexa proc for non-ovarian/adnexal malig w/o CC/MCC",0.609,19.1,15.9
742,Uterine & adnexa proc for non-malignancy w CC/MCC,1.0772,26.3,21.9
743,Uterine & adnexa proc for non-malignancy w/o CC/MCC,1.0772,26.3,21.9
744,"D&C, conization, laparoscopy & tubal interruption w CC/MCC",0.4545,15.4,12.8
745,"D&C, conization, laparoscopy & tubal interruption w/o CC/MCC",0.4545,15.4,12.8
746,"Vagina, cervix & vulva procedures w CC/MCC",1.0772,26.3,21.9
747,"Vagina, cervix & vulva procedures w/o CC/MCC",1.0772,26.3,21.9
748,Female reproductive system reconstructive procedures,1.0772,26.3,21.9
749,Other female reproductive system O.R. procedures w CC/MCC,1.0772,26.3,21.9
750,Other female reproductive system O.R. procedures w/o CC/MCC,0.72,20.3,16.9
754,"Malignancy, female reproductive system w MCC",0.4545,15.4,12.8
755,"Malignancy, female reproductive system w CC",0.4545,15.4,12.8
756,"Malignancy, female reproductive system w/o CC/MCC",0.4545,15.4,12.8
757,"Infections, female reproductive system w MCC",0.9026,25.2,21.0
758,"Infections, female reproductive system w CC",0.8061,22.3,18.6
759,"Infections, female reproductive system w/o CC/MCC",0.609,19.1,15.9
760,Menstrual & other female reproductive system disorders w CC/MCC,0.8061,22.3,18.6
761,Menstrual & other female reproductive system disorders w/o CC/MCC,0.72,20.3,16.9
768,Vaginal delivery w O.R. proc except steril &/or D&C,0.609,19.1,15.9
769,Postpartum & post abortion diagnoses w O.R. procedure,0.609,19.1,15.9
770,"Abortion w D&C, aspiration curettage or hysterotomy",0.609,19.1,15.9
776,Postpartum & post abortion diagnoses w/o O.R. procedure,0.609,19.1,15.9
779,Abortion w/o D&C,0.609,19.1,15.9
783,Cesarean section w sterilization w MCC,1.0772,26.3,21.9
784,Cesarean section w sterilization w CC,1.0772,26.3,21.9
785,Cesarean section w sterilization w/o CC/MCC,1.0772,26.3,21.9
786,Cesarean section w/o sterilization w MCC,1.0772,26.3,21.9
787,Cesarean section w/o sterilization w CC,1.0772,26.3,21.9
788,Cesarean section w/o sterilization w/o CC/MCC,1.0772,26.3,21.9
789,"Neonates, died or transferred to another acute care facility",0.609,19.1,15.9
790,"Extreme immaturity or respiratory distress syndrome, neonate",0.609,19.1,15.9
791,Prematurity w major problems,0.609,19.1,15.9
792,Prematurity w/o major problems,0.609,19.1,15.9
793,Full term neonate w major problems,0.609,19.1,15.9
794,Neonate w other significant problems,0.609,19.1,15.9
795,Normal newborn,0.609,19.1,15.9
796,Vaginal delivery w sterilization/D&C w MCC,0.609,19.1,15.9
797,Vaginal delivery w sterilization/D&C w CC,0.609,19.1,15.9
798,Vaginal delivery w sterilization/D&C wo CC/MCC,0.609,19.1,15.9
799,Splenectomy w MCC,1.538,34.2,28.5
800,Splenectomy w CC,1.0772,26.3,21.9
801,Splenectomy w/o CC/MCC,1.0772,26.3,21.9
802,Other O.R. proc of the blood & blood forming organs w MCC,1.7328,37.2,31.0
803,Other O.R. proc of the blood & blood forming organs w CC,0.4545,15.4,12.8
804,Other O.R. proc of the blood & blood forming organs w/o CC/MCC,0.4545,15.4,12.8
805,Vaginal delivery w/o sterilization/D&C w MCC,0.4545,15.4,12.8
806,Vaginal delivery w/o sterilization/D&C w CC,0.4545,15.4,12.8
807,Vaginal delivery w/o sterilization/D&C w/o CC/MCC,0.4545,15.4,12.8
808,Major hematol/immun diag exc sickle cell crisis & coagul w MCC,1.7328,37.2,31.0
809,Major hematol/immun diag exc sickle cell crisis & coagul w CC,0.4545,15.4,12.8
810,Major hematol/immun diag exc sickle cell crisis & coagul w/o CC/MCC,0.4545,15.4,12.8
811,Red blood cell disorders w MCC,1.0772,26.3,21.9
812,Red blood cell disorders w/o MCC,1.0772,26.3,21.9
813,Coagulation disorders,0.8061,22.3,18.6
814,Reticuloendothelial & immunity disorders w MCC,0.609,19.1,15.9
815,Reticuloendothelial & immunity disorders w CC,0.609,19.1,15.9
816,Reticuloendothelial & immunity disorders w/o CC/MCC,0.4545,15.4,12.8
817,Other antepartum diagnoses w O.R. procedure w MCC,0.609,19.1,15.9
818,Other antepartum diagnoses w O.R. procedure w CC,0.609,19.1,15.9
819,Other antepartum diagnoses w O.R. procedure w/o CC/MCC,0.609,19.1,15.9
820,Lymphoma & leukemia w major O.R. procedure w MCC,1.7328,37.2,31.0
821,Lymphoma & leukemia w major O.R. procedure w CC,1.7328,37.2,31.0
822,Lymphoma & leukemia w major O.R. procedure w/o CC/MCC,1.7328,37.2,31.0
823,Lymphoma & non-acute leukemia w other proc w MCC,1.7328,37.2,31.0
824,Lymphoma & non-acute leukemia w other proc w CC,1.104,32.6,27.2
825,Lymphoma & non-acute leukemia w other proc w/o CC/MCC,1.0772,26.3,21.9
826,Myeloprolif disord or poorly diff neopl w maj O.R. proc w MCC,1.7328,37.2,31.0
827,Myeloprolif disord or poorly diff neopl w maj O.R. proc w CC,1.7328,37.2,31.0
828,Myeloprolif disord or poorly diff neopl w maj O.R. proc w/o CC/MCC,1.7328,37.2,31.0
829,Myeloproliferative disorders or poorly differentiated neoplasms w other procedure w CC/MCC,1.7328,37.2,31.0
830,Myeloproliferative disorders or poorly differentiated neoplasms w other procedure w/o CC/MCC,1.7328,37.2,31.0
831,Other antepartum diagnoses w/o O.R. procedure w MCC,0.609,19.1,15.9
832,Other antepartum diagnoses w/o O.R. Procedure w CC,0.609,19.1,15.9
833,Other antepartum diagnoses w/o O.R. procedure w/o CC/MCC,0.609,19.1,15.9
834,Acute leukemia w/o major O.R. procedure w MCC,0.609,19.1,15.9
835,Acute leukemia w/o major O.R. procedure w CC,0.609,19.1,15.9
836,Acute leukemia w/o major O.R. procedure w/o CC/MCC,0.609,19.1,15.9
837,Chemo w acute leukemia as sdx or w high dose chemo agent w MCC,0.609,19.1,15.9
838,Chemo w acute leukemia as sdx w CC or high dose chemo agent,0.609,19.1,15.9
839,Chemo w acute leukemia as sdx w/o CC/MCC,0.609,19.1,15.9
840,Lymphoma & non-acute leukemia w MCC,1.0772,26.3,21.9
841,Lymphoma & non-acute leukemia w CC,0.8061,22.3,18.6
842,Lymphoma & non-acute leukemia w/o CC/MCC,0.8061,22.3,18.6
843,Other myeloprolif dis or poorly diff neopl diag w MCC,0.8061,22.3,18.6
844,Other myeloprolif dis or poorly diff neopl diag w CC,0.8061,22.3,18.6
845,Other myeloprolif dis or poorly diff neopl diag w/o CC/MCC,0.8061,22.3,18.6
846,Chemotherapy w/o acute leukemia as secondary diagnosis w MCC,1.0772,26.3,21.9
847,Chemotherapy w/o acute leukemia as secondary diagnosis w CC,0.609,19.1,15.9
848,Chemotherapy w/o acute leukemia as secondary diagnosis w/o CC/MCC,0.609,19.1,15.9
849,Radiotherapy,0.8061,22.3,18.6
853,Infectious & parasitic diseases w O.R. procedure w MCC,1.8284,36.5,30.4
854,Infectious & parasitic diseases w O.R. procedure w CC,0.8449,21.9,18.3
855,Infectious & parasitic diseases w O.R. procedure w/o CC/MCC,0.8449,21.9,18.3
856,Postoperative or post-traumatic infections w O.R. proc w MCC,1.4949,33.8,28.2
857,Postoperative or post-traumatic infections w O.R. proc w CC,0.9851,26.5,22.1
858,Postoperative or post-traumatic infections w O.R. proc w/o CC/MCC,0.9851,26.5,22.1
862,Postoperative & post-traumatic infections w MCC,1.0186,25.5,21.3
863,Postoperative & post-traumatic infections w/o MCC,0.7421,22.5,18.8
864,Fever and inflammatory conditions,0.8061,22.3,18.6
865,Viral illness w MCC,1.0772,26.3,21.9
866,Viral illness w/o MCC,0.4545,15.4,12.8
867,Other infectious & parasitic diseases diagnoses w MCC,1.0761,23.9,19.9
868,Other infectious & parasitic diseases diagnoses w CC,0.8061,22.3,18.6
869,Other infectious & parasitic diseases diagnoses w/o CC/MCC,0.4545,15.4,12.8
870,Septicemia or severe sepsis w MV >96 hours,1.9597,29.9,24.9
871,Septicemia or severe sepsis w/o MV >96 hours w MCC,0.9185,22.6,18.8
872,Septicemia or severe sepsis w/o MV >96 hours w/o MCC,0.6172,18.5,15.4
876,O.R. procedure w principal diagnoses of mental illness,0.7881,22.9,19.1
880,Acute adjustment reaction & psychosocial dysfunction,0.4959,17.7,14.8
881,Depressive neuroses,0.6214,20.3,16.9
882,Neuroses except depressive,0.6214,20.3,16.9
883,Disorders of personality & impulse control,0.6214,20.3,16.9
884,Organic disturbances & intellectual disability,0.5152,24.5,20.4
885,Psychoses,0.4901,23.1,19.3
886,Behavioral & developmental disorders,0.4959,17.7,14.8
887,Other mental disorder diagnoses,0.4959,17.7,14.8
894,"Alcohol/drug abuse or dependence, left ama",0.4959,17.7,14.8
895,Alcohol/drug abuse or dependence w rehabilitation therapy,0.467,25.4,21.2
896,Alcohol/drug abuse or dependence w/o rehabilitation therapy w MCC,0.7881,22.9,19.1
897,Alcohol/drug abuse or dependence w/o rehabilitation therapy w/o MCC,0.6214,20.3,16.9
901,Wound debridements for injuries w MCC,1.4732,34.4,28.7
902,Wound debridements for injuries w CC,1.0258,27.0,22.5
903,Wound debridements for injuries w/o CC/MCC,0.4545,15.4,12.8
904,Skin grafts for injuries w CC/MCC,1.7328,37.2,31.0
905,Skin grafts for injuries w/o CC/MCC,0.9924,31.1,25.9
906,Hand procedures for injuries,1.4466,33.9,28.3
907,Other O.R. procedures for injuries w MCC,1.4466,33.9,28.3
908,Other O.R. procedures for injuries w CC,0.8061,22.3,18.6
909,Other O.R. procedures for injuries w/o CC/MCC,0.4545,15.4,12.8
913,Traumatic injury w MCC,1.7328,37.2,31.0
914,Traumatic injury w/o MCC,0.4545,15.4,12.8
915,Allergic reactions w MCC,0.609,19.1,15.9
916,Allergic reactions w/o MCC,0.4545,15.4,12.8
917,Poisoning & toxic effects of drugs w MCC,0.609,19.1,15.9
918,Poisoning & toxic effects of drugs w/o MCC,0.609,19.1,15.9
919,Complications of treatment w MCC,1.1498,26.8,22.3
920,Complications of treatment w CC,0.8375,24.1,20.1
921,Complications of treatment w/o CC/MCC,0.4545,15.4,12.8
922,"Other injury, poisoning & toxic effect diag w MCC",1.7328,37.2,31.0
923,"Other injury, poisoning & toxic effect diag w/o MCC",1.0772,26.3,21.9
927,Extensive burns or full thickness burns w MV >96 hrs w skin graft,1.7328,37.2,31.0
928,Full thickness burn w skin graft or inhal inj w CC/MCC,1.7328,37.2,31.0
929,Full thickness burn w skin graft or inhal inj w/o CC/MCC,1.7328,37.2,31.0
933,Extensive burns or full thickness burns w MV >96 hrs w/o skin graft,1.0772,26.3,21.9
934,Full thickness burn w/o skin grft or inhal inj,1.0772,26.3,21.9
935,Non-extensive burns,0.8061,22.3,18.6
939,O.R. proc w diagnoses of other contact w health services w MCC,1.369,32.4,27.0
940,O.R. proc w diagnoses of other contact w health services w CC,1.0068,29.2,24.3
941,O.R. proc w diagnoses of other contact w health services w/o CC/MCC,0.4545,15.4,12.8
945,Rehabilitation w CC/MCC,0.6621,20.5,17.1
946,Rehabilitation w/o CC/MCC,0.4063,16.3,13.6
947,Signs & symptoms w MCC,0.9518,19.8,16.5
948,Signs & symptoms w/o MCC,0.8061,22.3,18.6
949,Aftercare w CC/MCC,0.7419,21.7,18.1
950,Aftercare w/o CC/MCC,0.4054,14.7,12.3
951,Other factors influencing health status,0.4545,15.4,12.8
955,Craniotomy for multiple significant trauma,0.8061,22.3,18.6
956,"Limb reattachment, hip & femur proc for multiple significant trauma",0.4545,15.4,12.8
957,Other O.R. procedures for multiple significant trauma w MCC,1.7328,37.2,31.0
958,Other O.R. procedures for multiple significant trauma w CC,1.0772,26.3,21.9
959,Other O.R. procedures for multiple significant trauma w/o CC/MCC,0.8061,22.3,18.6
963,Other multiple significant trauma w MCC,1.0772,26.3,21.9
964,Other multiple significant trauma w CC,0.8061,22.3,18.6
965,Other multiple significant trauma w/o CC/MCC,0.8061,22.3,18.6
969,HIV w extensive O.R. procedure w MCC,1.7328,37.2,31.0
970,HIV w extensive O.R. procedure w/o MCC,1.7328,37.2,31.0
974,HIV w major related condition w MCC,1.0109,22.4,18.7
975,HIV w major related condition w CC,1.0109,22.4,18.7
976,HIV w major related condition w/o CC/MCC,1.0109,22.4,18.7
977,HIV w or w/o other related condition,0.8061,22.3,18.6
981,Extensive O.R. procedure unrelated to principal diagnosis w MCC,2.217,40.0,33.3
982,Extensive O.R. procedure unrelated to principal diagnosis w CC,1.3574,32.4,27.0
983,Extensive O.R. procedure unrelated to principal diagnosis w/o CC/MCC,0.609,19.1,15.9
987,Non-extensive O.R. proc unrelated to principal diagnosis w MCC,1.8865,37.9,31.6
988,Non-extensive O.R. proc unrelated to principal diagnosis w CC,1.7328,37.2,31.0
989,Non-extensive O.R. proc unrelated to principal diagnosis w/o CC/MCC,0.4545,15.4,12.8
998,Principal diagnosis invalid as discharge diagnosis,0.0,0.0,0.0
999,Ungroupable,0.0,0.0,0.0
