drg,title,relative_weight,gmlos,sso
876,O.R. procedures with principal diagnosis of mental illness,0.7881,22.9,19.1
880,Acute adjustment reaction and psychosocial dysfunction,0.4959,17.7,14.8
881,Depressive neuroses,0.6214,20.3,16.9
882,Neuroses except depressive,0.6214,20.3,16.9
883,Disorders of personality and impulse control,0.6214,20.3,16.9
884,Organic disturbances and intellectual disability,0.5152,24.5,20.4
885,Psychoses,0.4901,23.1,19.3
886,Behavioral and developmental disorders,0.4959,17.7,14.8
887,Other mental disorder diagnoses,0.4959,17.7,14.8
894,"Alcohol, drug abuse or dependence, left AMA",0.4959,17.7,14.8
895,"Alcohol, drug abuse or dependence with rehabilitation
therapy",0.467,25.4,21.2
896,"Alcohol, drug abuse or dependence without rehabilitation
therapy with MCC",0.7881,22.9,19.1
897,"Alcohol, drug abuse or dependence without rehabilitation
therapy without MCC",0.6214,20.3,16.9
901,Wound debridements for injuries with MCC,1.4269,33.0,27.5
902,Wound debridements for injuries with CC,0.9522,29.3,24.4
903,Wound debridements for injuries without CC/MCC,0.9522,29.3,24.4
904,Skin grafts for injuries with CC/MCC,1.7606,36.6,30.5
905,Skin grafts for injuries without CC/MCC,0.6431,19.4,16.2
906,Hand procedures for injuries,0.5191,16.9,14.1
907,Other O.R. procedures for injuries with MCC,1.5108,33.3,27.8
908,Other O.R. procedures for injuries with CC,0.8438,23.5,19.6
909,Other O.R. procedures for injuries without CC/MCC,0.8438,23.5,19.6
913,Traumatic injury with MCC,0.8438,23.5,19.6
914,Traumatic injury without MCC,0.8438,23.5,19.6
915,Allergic reactions with MCC,1.0691,26.0,21.7
916,Allergic reactions without MCC,1.0691,26.0,21.7
917,Poisoning and toxic effects of drugs with MCC,1.0691,26.0,21.7
918,Poisoning and toxic effects of drugs without MCC,1.0691,26.0,21.7
919,Complications of treatment with MCC,1.1628,28.1,23.4
920,Complications of treatment with CC,0.841,23.9,19.9
921,Complications of treatment without CC/MCC,0.6431,19.4,16.2
922,"Other injury, poisoning and toxic effect diagnoses with MCC",0.8438,23.5,19.6
923,"Other injury, poisoning and toxic effect diagnoses without
MCC",0.8438,23.5,19.6
927,"Extensive burns or full thickness burns with MV >96 hours
with skin graft",1.7606,36.6,30.5
928,"Full thickness burn with skin graft or inhalation injury with
CC/MCC",1.7606,36.6,30.5
929,"Full thickness burn with skin graft or inhalation injury without
CC/MCC",1.7606,36.6,30.5
933,"Extensive burns or full thickness burns with MV >96 hours
without skin graft",0.8438,23.5,19.6
934,Full thickness burn without skin graft or inhalation injury,0.6431,19.4,16.2
935,Non-extensive burns,0.8438,23.5,19.6
939,"O.R. procedures with diagnoses of other contact with health
services with MCC",1.3077,32.9,27.4
940,"O.R. procedures with diagnoses of other contact with health
services with CC",0.9486,29.3,24.4
941,"O.R. procedures with diagnoses of other contact with health
services without CC/MCC",0.9486,29.3,24.4
945,Rehabilitation with CC/MCC,0.6621,20.5,17.1
946,Rehabilitation without CC/MCC,0.4063,16.3,13.6
947,Signs and symptoms with MCC,0.7768,20.1,16.8
948,Signs and symptoms without MCC,0.6431,19.4,16.2
949,Aftercare with CC/MCC,0.755,21.7,18.1
950,Aftercare without CC/MCC,0.4201,15.1,12.6
951,Other factors influencing health status,0.4201,15.1,12.6
955,Craniotomy for multiple significant trauma,1.0691,26.0,21.7
956,"Limb reattachment, hip and femur procedures for multiple
significant trauma",1.0691,26.0,21.7
957,"Other O.R. procedures for multiple significant trauma with
MCC",1.0691,26.0,21.7
958,Other O.R. procedures for multiple significant trauma with CC,1.0691,26.0,21.7
959,"Other O.R. procedures for multiple significant trauma without
CC/MCC",1.0691,26.0,21.7
963,Other multiple significant trauma with MCC,1.0691,26.0,21.7
964,Other multiple significant trauma with CC,0.5191,16.9,14.1
965,Other multiple significant trauma without CC/MCC,0.5191,16.9,14.1
969,HIV with extensive O.R. procedures with MCC,1.7606,36.6,30.5
970,HIV with extensive O.R. procedures without MCC,1.7606,36.6,30.5
974,HIV with major related condition with MCC,1.1772,23.2,19.3
975,HIV with major related condition with CC,1.0691,26.0,21.7
976,HIV with major related condition without CC/MCC,1.0691,26.0,21.7
977,HIV with or without other related condition,1.0691,26.0,21.7
981,"Extensive O.R. procedures unrelated to principal diagnosis
with MCC",2.2674,40.7,33.9
982,"Extensive O.R. procedures unrelated to principal diagnosis
with CC",1.2929,30.5,25.4
983,"Extensive O.R. procedures unrelated to principal diagnosis
without CC/MCC",1.2929,30.5,25.4
987,"Non-extensive O.R. procedures unrelated to principal
diagnosis with MCC",1.9761,39.3,32.8
988,"Non-extensive O.R. procedures unrelated to principal
diagnosis with CC",1.0691,26.0,21.7
989,"Non-extensive O.R. procedures unrelated to principal
diagnosis without CC/MCC",0.6431,19.4,16.2
998,Principal diagnosis invalid as discharge diagnosis,0.0,0.0,0.0
999,Ungroupable,0.0,0.0,0.0
