drg,title,relative_weight,gmlos,sso
1,Heart transplant or implant of heart assist system with MCC,0.0,0.0,0.0
2,"Heart transplant or implant of heart assist system without
MCC",0.0,0.0,0.0
3,"ECMO or tracheostomy with MV >96 hours or principal
diagnosis except face, mouth and neck with major O.R.
procedures",3.6215,54.8,45.7
4,"Tracheostomy with MV >96 hours or principal diagnosis
except face, mouth and neck without major O.R. procedures",2.7772,43.3,36.1
5,Liver transplant with MCC or intestinal transplant,0.0,0.0,0.0
6,Liver transplant without MCC,0.0,0.0,0.0
7,Lung transplant,0.0,0.0,0.0
8,Simultaneous pancreas and kidney transplant,0.0,0.0,0.0
10,Pancreas transplant,0.0,0.0,0.0
11,"Tracheostomy for face, mouth and neck diagnoses or
laryngectomy with MCC",0.6431,19.4,16.2
12,"Tracheostomy for face, mouth and neck diagnoses or
laryngectomy with CC",0.6431,19.4,16.2
13,"Tracheostomy for face, mouth and neck diagnoses or
laryngectomy without CC/MCC",0.6431,19.4,16.2
14,Allogeneic bone marrow transplant,0.5191,16.9,14.1
16,Autologous bone marrow transplant with CC/MCC,0.5191,16.9,14.1
17,Autologous bone marrow transplant without CC/MCC,0.5191,16.9,14.1
18,Chimeric antigen receptor (CAR) T-cell immunotherapy,0.5191,16.9,14.1
19,Simultaneous pancreas and kidney transplant with hemodialysis,0.0,0.0,0.0
20,"Intracranial vascular procedures with principal diagnosis
hemorrhage with MCC",0.9251,24.9,20.8
21,"Intracranial vascular procedures with principal diagnosis
hemorrhage with CC",0.9251,24.9,20.8
22,"Intracranial vascular procedures with principal diagnosis
hemorrhage without CC/MCC",0.9251,24.9,20.8
23,"Craniotomy with major device implant or acute complex CNS
principal diagnosis with MCC or chemotherapy implant or
epilepsy with neurostimulator",0.6431,19.4,16.2
24,"Craniotomy with major device implant or acute complex CNS
principal diagnosis without MCC",0.6431,19.4,16.2
25,"Craniotomy and endovascular intracranial procedures with
MCC",1.7606,36.6,30.5
26,"Craniotomy and endovascular intracranial procedures with
CC",0.6431,19.4,16.2
27,"Craniotomy and endovascular intracranial procedures without
CC/MCC",0.6431,19.4,16.2
28,Spinal procedures with MCC,1.7606,36.6,30.5
29,Spinal procedures with CC or spinal neurostimulators,0.9235,24.8,20.7
30,Spinal procedures without CC/MCC,0.9235,24.8,20.7
31,Ventricular shunt procedures with MCC,0.8438,23.5,19.6
32,Ventricular shunt procedures with CC,0.8438,23.5,19.6
33,Ventricular shunt procedures without CC/MCC,0.8438,23.5,19.6
34,Carotid artery stent procedures with MCC,1.8864,39.8,33.2
35,Carotid artery stent procedures with CC,1.8864,39.8,33.2
36,Carotid artery stent procedures without CC/MCC,1.8864,39.8,33.2
37,Extracranial procedures with MCC,1.7606,36.6,30.5
38,Extracranial procedures with CC,1.7606,36.6,30.5
39,Extracranial procedures without CC/MCC,1.7606,36.6,30.5
40,"Peripheral, cranial nerve and other nervous system
procedures with MCC",1.388,34.8,29.0
41,"Peripheral, cranial nerve and other nervous system
procedures with CC or peripheral neurostimulator",0.6431,19.4,16.2
42,"Peripheral, cranial nerve and other nervous system
procedures without CC/MCC",0.6431,19.4,16.2
52,Spinal disorders and injuries with CC/MCC,0.9832,33.0,27.5
53,Spinal disorders and injuries without CC/MCC,0.9832,33.0,27.5
54,Nervous system neoplasms with MCC,1.0691,26.0,21.7
55,Nervous system neoplasms without MCC,0.6431,19.4,16.2
56,Degenerative nervous system disorders with MCC,0.8412,24.0,20.0
57,Degenerative nervous system disorders without MCC,0.6678,22.5,18.8
58,Multiple sclerosis and cerebellar ataxia with MCC,0.6431,19.4,16.2
59,Multiple sclerosis and cerebellar ataxia with CC,0.6431,19.4,16.2
60,Multiple sclerosis and cerebellar ataxia without CC/MCC,0.6431,19.4,16.2
61,"Ischemic stroke, precerebral occlusion or transient ischemia
with thrombolytic agent with MCC",0.873,23.4,19.5
62,"Ischemic stroke, precerebral occlusion or transient ischemia
with thrombolytic agent with CC",0.7305,20.1,16.8
63,"Ischemic stroke, precerebral occlusion or transient ischemia
with thrombolytic agent without CC/MCC",0.6431,19.4,16.2
64,Intracranial hemorrhage or cerebral infarction with MCC,0.9251,24.9,20.8
65,"Intracranial hemorrhage or cerebral infarction with CC or tPA
in 24 hours",0.5191,16.9,14.1
66,"Intracranial hemorrhage or cerebral infarction without
CC/MCC",0.5191,16.9,14.1
67,"Nonspecific CVA and precerebral occlusion without infarction
with MCC",0.6431,19.4,16.2
68,"Nonspecific CVA and precerebral occlusion without infarction
without MCC",0.6431,19.4,16.2
69,Transient ischemia without thrombolytic,0.5191,16.9,14.1
70,Nonspecific cerebrovascular disorders with MCC,0.873,23.4,19.5
71,Nonspecific cerebrovascular disorders with CC,0.7305,20.1,16.8
72,Nonspecific cerebrovascular disorders without CC/MCC,0.6431,19.4,16.2
73,Cranial and peripheral nerve disorders with MCC,0.9235,24.8,20.7
74,Cranial and peripheral nerve disorders without MCC,0.9235,24.8,20.7
75,Viral meningitis with CC/MCC,0.6431,19.4,16.2
76,Viral meningitis without CC/MCC,0.6431,19.4,16.2
77,Hypertensive encephalopathy with MCC,0.6431,19.4,16.2
78,Hypertensive encephalopathy with CC,0.6431,19.4,16.2
79,Hypertensive encephalopathy without CC/MCC,0.6431,19.4,16.2
80,Nontraumatic stupor and coma with MCC,1.7606,36.6,30.5
81,Nontraumatic stupor and coma without MCC,0.5191,16.9,14.1
82,Traumatic stupor and coma >1 hour with MCC,1.027,28.9,24.1
83,Traumatic stupor and coma >1 hour with CC,0.7535,23.6,19.7
84,Traumatic stupor and coma >1 hour without CC/MCC,0.5191,16.9,14.1
85,Traumatic stupor and coma <1 hour with MCC,1.026,25.7,21.4
86,Traumatic stupor and coma <1 hour with CC,0.6431,19.4,16.2
87,Traumatic stupor and coma <1 hour without CC/MCC,0.6431,19.4,16.2
88,Concussion with MCC,1.7606,36.6,30.5
89,Concussion with CC,0.6431,19.4,16.2
90,Concussion without CC/MCC,0.6431,19.4,16.2
91,Other disorders of nervous system with MCC,0.8704,23.3,19.4
92,Other disorders of nervous system with CC,0.8704,23.3,19.4
93,Other disorders of nervous system without CC/MCC,0.8704,23.3,19.4
94,"Bacterial and tuberculous infections of nervous system with
MCC",1.0665,27.2,22.7
95,"Bacterial and tuberculous infections of nervous system with
CC",0.7534,20.5,17.1
96,"Bacterial and tuberculous infections of nervous system
without CC/MCC",0.5191,16.9,14.1
97,"Non-bacterial infection of nervous system except viral
meningitis with MCC",0.9602,21.9,18.3
98,"Non-bacterial infection of nervous system except viral
meningitis with CC",0.8438,23.5,19.6
99,"Non-bacterial infection of nervous system except viral
meningitis without CC/MCC",0.8438,23.5,19.6
100,Seizures with MCC,0.7234,21.5,17.9
101,Seizures without MCC,0.6431,19.4,16.2
102,Headaches with MCC,0.6431,19.4,16.2
103,Headaches without MCC,0.6431,19.4,16.2
113,Orbital procedures with CC/MCC,0.6431,19.4,16.2
114,Orbital procedures without CC/MCC,0.6431,19.4,16.2
115,Extraocular procedures except orbit,0.6431,19.4,16.2
116,Intraocular procedures with CC/MCC,0.6431,19.4,16.2
117,Intraocular procedures without CC/MCC,0.6431,19.4,16.2
121,Acute major eye infections with CC/MCC,1.0691,26.0,21.7
122,Acute major eye infections without CC/MCC,0.6431,19.4,16.2
123,Neurological eye disorders,0.6431,19.4,16.2
124,Other disorders of the eye with MCC,0.6431,19.4,16.2
125,Other disorders of the eye without MCC,0.6431,19.4,16.2
135,Sinus and mastoid procedures with CC/MCC,0.6431,19.4,16.2
136,Sinus and mastoid procedures without CC/MCC,0.6431,19.4,16.2
137,Mouth procedures with CC/MCC,0.6431,19.4,16.2
138,Mouth procedures without CC/MCC,0.6431,19.4,16.2
139,Salivary gland procedures,0.5191,16.9,14.1
140,Major head and neck procedures with MCC,0.5191,16.9,14.1
141,Major head and neck procedures with CC,0.5191,16.9,14.1
142,Major head and neck procedures without CC/MCC,0.5191,16.9,14.1
143,"Other ear, nose, mouth and throat O.R. procedures with
MCC",0.8438,23.5,19.6
144,"Other ear, nose, mouth and throat O.R. procedures with CC",0.8438,23.5,19.6
145,"Other ear, nose, mouth and throat O.R. procedures without
CC/MCC",0.8438,23.5,19.6
146,"Ear, nose, mouth and throat malignancy with MCC",0.8438,23.5,19.6
147,"Ear, nose, mouth and throat malignancy with CC",0.6431,19.4,16.2
148,"Ear, nose, mouth and throat malignancy without CC/MCC",0.5191,16.9,14.1
149,Dysequilibrium,0.5191,16.9,14.1
150,Epistaxis with MCC,0.8438,23.5,19.6
151,Epistaxis without MCC,0.8438,23.5,19.6
152,Otitis media and URI with MCC,0.8438,23.5,19.6
153,Otitis media and URI without MCC,0.6431,19.4,16.2
154,"Other ear, nose, mouth and throat diagnoses with MCC",1.7606,36.6,30.5
155,"Other ear, nose, mouth and throat diagnoses with CC",0.6431,19.4,16.2
156,"Other ear, nose, mouth and throat diagnoses without
CC/MCC",0.6431,19.4,16.2
157,Dental and oral diseases with MCC,1.0691,26.0,21.7
158,Dental and oral diseases with CC,0.8438,23.5,19.6
159,Dental and oral diseases without CC/MCC,0.6431,19.4,16.2
163,Major chest procedures with MCC,2.8678,44.9,37.4
164,Major chest procedures with CC,0.8438,23.5,19.6
165,Major chest procedures without CC/MCC,0.8438,23.5,19.6
166,Other respiratory system O.R. procedures with MCC,2.3509,40.0,33.3
167,Other respiratory system O.R. procedures with CC,1.4267,29.1,24.3
168,Other respiratory system O.R. procedures without CC/MCC,1.4267,29.1,24.3
175,Pulmonary embolism with MCC or acute cor pulmonale,0.7253,20.6,17.2
176,Pulmonary embolism without MCC,0.7253,20.6,17.2
177,Respiratory infections and inflammations with MCC,0.8259,21.6,18.0
178,Respiratory infections and inflammations with CC,0.598,18.6,15.5
179,Respiratory infections and inflammations without CC/MCC,0.598,18.6,15.5
180,Respiratory neoplasms with MCC,0.8438,23.5,19.6
181,Respiratory neoplasms with CC,0.5191,16.9,14.1
182,Respiratory neoplasms without CC/MCC,0.5191,16.9,14.1
183,Major chest trauma with MCC,0.6431,19.4,16.2
184,Major chest trauma with CC,0.6431,19.4,16.2
185,Major chest trauma without CC/MCC,0.6431,19.4,16.2
186,Pleural effusion with MCC,0.8212,20.6,17.2
187,Pleural effusion with CC,0.6431,19.4,16.2
188,Pleural effusion without CC/MCC,0.6431,19.4,16.2
189,Pulmonary edema and respiratory failure,0.9446,21.3,17.8
190,Chronic obstructive pulmonary disease with MCC,0.7303,18.9,15.8
191,Chronic obstructive pulmonary disease with CC,0.6578,16.3,13.6
192,Chronic obstructive pulmonary disease without CC/MCC,0.6578,16.3,13.6
193,Simple pneumonia and pleurisy with MCC,0.7073,19.0,15.8
194,Simple pneumonia and pleurisy with CC,0.6168,17.9,14.9
195,Simple pneumonia and pleurisy without CC/MCC,0.5191,16.9,14.1
196,Interstitial lung disease with MCC,0.6431,19.4,16.2
197,Interstitial lung disease with CC,0.5191,16.9,14.1
198,Interstitial lung disease without CC/MCC,0.5191,16.9,14.1
199,Pneumothorax with MCC,0.5946,17.9,14.9
200,Pneumothorax with CC,0.5946,17.9,14.9
201,Pneumothorax without CC/MCC,0.5946,17.9,14.9
202,Bronchitis and asthma with CC/MCC,1.0691,26.0,21.7
203,Bronchitis and asthma without CC/MCC,0.5191,16.9,14.1
204,Respiratory signs and symptoms,1.7606,36.6,30.5
205,Other respiratory system diagnoses with MCC,0.9098,23.1,19.3
206,Other respiratory system diagnoses without MCC,0.8438,23.5,19.6
207,"Respiratory system diagnosis with ventilator support >96
hours",1.8773,31.9,26.6
208,"Respiratory system diagnosis with ventilator support <=96
hours",1.14,22.1,18.4
215,Other heart assist system implant,1.9394,33.8,28.2
216,"Cardiac valve and other major cardiothoracic procedures with
cardiac catheterization with MCC",1.9394,33.8,28.2
217,"Cardiac valve and other major cardiothoracic procedures with
cardiac catheterization with CC",1.9394,33.8,28.2
218,"Cardiac valve and other major cardiothoracic procedures with
cardiac catheterization without CC/MCC",1.9394,33.8,28.2
219,"Cardiac valve and other major cardiothoracic procedures
without cardiac catheterization with MCC",1.9394,33.8,28.2
220,"Cardiac valve and other major cardiothoracic procedures
without cardiac catheterization with CC",1.9394,33.8,28.2
221,"Cardiac valve and other major cardiothoracic procedures
without cardiac catheterization without CC/MCC",1.9394,33.8,28.2
222,"Cardiac defibrillator implant with cardiac catheterization with
AMI, HF or shock with MCC",1.7606,36.6,30.5
223,"Cardiac defibrillator implant with cardiac catheterization with
AMI, HF or shock without MCC",1.7606,36.6,30.5
224,"Cardiac defibrillator implant with cardiac catheterization
without AMI, HF or shock with MCC",1.7606,36.6,30.5
225,"Cardiac defibrillator implant with cardiac catheterization
without AMI, HF or shock without MCC",1.7606,36.6,30.5
226,"Cardiac defibrillator implant without cardiac catheterization
with MCC",1.0691,26.0,21.7
227,"Cardiac defibrillator implant without cardiac catheterization
without MCC",1.0691,26.0,21.7
228,Other cardiothoracic procedures with MCC,1.0691,26.0,21.7
229,Other cardiothoracic procedures without MCC,1.0691,26.0,21.7
231,Coronary bypass with PTCA with MCC,1.9394,33.8,28.2
232,Coronary bypass with PTCA without MCC,1.9394,33.8,28.2
233,Coronary bypass with cardiac catheterization with MCC,1.9394,33.8,28.2
234,Coronary bypass with cardiac catheterization without MCC,1.9394,33.8,28.2
235,Coronary bypass without cardiac catheterization with MCC,1.9394,33.8,28.2
236,"Coronary bypass without cardiac catheterization without
MCC",1.9394,33.8,28.2
239,"Amputation for circulatory system disorders except upper
limb and toe with MCC",1.8864,39.8,33.2
240,"Amputation for circulatory system disorders except upper
limb and toe with CC",1.7606,36.6,30.5
241,"Amputation for circulatory system disorders except upper
limb and toe without CC/MCC",1.7606,36.6,30.5
242,Permanent cardiac pacemaker implant with MCC,1.7606,36.6,30.5
243,Permanent cardiac pacemaker implant with CC,1.0691,26.0,21.7
244,Permanent cardiac pacemaker implant without CC/MCC,1.0691,26.0,21.7
245,AICD generator procedures,1.0691,26.0,21.7
246,"Percutaneous cardiovascular procedures with drug-eluting
stent with MCC or 4 arteries or stents",1.7606,36.6,30.5
247,"Percutaneous cardiovascular procedures with drug-eluting
stent without MCC",1.0691,26.0,21.7
248,"Percutaneous cardiovascular procedures with
non-drug-eluting stent with MCC or 4 arteries or stents",1.7606,36.6,30.5
249,"Percutaneous cardiovascular procedures with
non-drug-eluting stent without MCC",1.7606,36.6,30.5
250,"Percutaneous cardiovascular procedures without coronary
artery stent with MCC",1.7606,36.6,30.5
251,"Percutaneous cardiovascular procedures without coronary
artery stent without MCC",1.7606,36.6,30.5
252,Other vascular procedures with MCC,1.9394,33.8,28.2
253,Other vascular procedures with CC,1.9394,33.8,28.2
254,Other vascular procedures without CC/MCC,1.9394,33.8,28.2
255,"Upper limb and toe amputation for circulatory system
disorders with MCC",1.7606,36.6,30.5
256,"Upper limb and toe amputation for circulatory system
disorders with CC",1.7606,36.6,30.5
257,"Upper limb and toe amputation for circulatory system
disorders without CC/MCC",1.7606,36.6,30.5
258,Cardiac pacemaker device replacement with MCC,1.0691,26.0,21.7
259,Cardiac pacemaker device replacement without MCC,1.0691,26.0,21.7
260,"Cardiac pacemaker revision except device replacement with
MCC",1.7606,36.6,30.5
261,"Cardiac pacemaker revision except device replacement with
CC",1.7606,36.6,30.5
262,"Cardiac pacemaker revision except device replacement
without CC/MCC",1.7606,36.6,30.5
263,Vein ligation and stripping,1.3518,32.1,26.8
264,Other circulatory system O.R. procedures,1.3518,32.1,26.8
265,AICD lead procedures,1.0691,26.0,21.7
266,"Endovascular cardiac valve replacement and supplement
procedures with MCC",1.3518,32.1,26.8
267,"Endovascular cardiac valve replacement and supplement
procedures without MCC",1.3518,32.1,26.8
268,"Aortic and heart assist procedures except pulsation balloon
with MCC",0.6431,19.4,16.2
269,"Aortic and heart assist procedures except pulsation balloon
without MCC",0.6431,19.4,16.2
270,Other major cardiovascular procedures with MCC,1.7606,36.6,30.5
271,Other major cardiovascular procedures with CC,1.0691,26.0,21.7
272,Other major cardiovascular procedures without CC/MCC,1.0691,26.0,21.7
273,Percutaneous and other intracardiac procedures with MCC,1.0691,26.0,21.7
274,"Percutaneous and other intracardiac procedures without
MCC",1.0691,26.0,21.7
280,"Acute myocardial infarction, discharged alive with MCC",0.902,23.4,19.5
281,"Acute myocardial infarction, discharged alive with CC",0.5191,16.9,14.1
282,"Acute myocardial infarction, discharged alive without
CC/MCC",0.5191,16.9,14.1
283,"Acute myocardial infarction, expired with MCC",0.8956,17.5,14.6
284,"Acute myocardial infarction, expired with CC",0.5191,16.9,14.1
285,"Acute myocardial infarction, expired without CC/MCC",0.5191,16.9,14.1
286,"Circulatory disorders except AMI, with cardiac catheterization
with MCC",1.7606,36.6,30.5
287,"Circulatory disorders except AMI, with cardiac catheterization
without MCC",1.0691,26.0,21.7
288,Acute and subacute endocarditis with MCC,1.1432,25.5,21.3
289,Acute and subacute endocarditis with CC,0.7798,23.5,19.6
290,Acute and subacute endocarditis without CC/MCC,0.7798,23.5,19.6
291,Heart failure and shock with MCC,0.8612,21.4,17.8
292,Heart failure and shock with CC,0.5876,18.0,15.0
293,Heart failure and shock without CC/MCC,0.5876,18.0,15.0
294,Deep vein thrombophlebitis with CC/MCC,0.8438,23.5,19.6
295,Deep vein thrombophlebitis without CC/MCC,0.8438,23.5,19.6
296,"Cardiac arrest, unexplained with MCC",0.6431,19.4,16.2
297,"Cardiac arrest, unexplained with CC",0.5191,16.9,14.1
298,"Cardiac arrest, unexplained without CC/MCC",0.5191,16.9,14.1
299,Peripheral vascular disorders with MCC,0.8427,22.5,18.8
300,Peripheral vascular disorders with CC,0.4918,18.6,15.5
301,Peripheral vascular disorders without CC/MCC,0.4918,18.6,15.5
302,Atherosclerosis with MCC,1.0125,24.8,20.7
303,Atherosclerosis without MCC,0.8438,23.5,19.6
304,Hypertension with MCC,1.7606,36.6,30.5
305,Hypertension without MCC,1.0691,26.0,21.7
306,Cardiac congenital and valvular disorders with MCC,0.837,22.5,18.8
307,Cardiac congenital and valvular disorders without MCC,0.5191,16.9,14.1
308,Cardiac arrhythmia and conduction disorders with MCC,0.7023,19.7,16.4
309,Cardiac arrhythmia and conduction disorders with CC,0.7023,19.7,16.4
310,"Cardiac arrhythmia and conduction disorders without
CC/MCC",0.5191,16.9,14.1
311,Angina pectoris,0.5191,16.9,14.1
312,Syncope and collapse,1.7606,36.6,30.5
313,Chest pain,0.5191,16.9,14.1
314,Other circulatory system diagnoses with MCC,1.0641,24.7,20.6
315,Other circulatory system diagnoses with CC,0.6324,20.3,16.9
316,Other circulatory system diagnoses without CC/MCC,0.6324,20.3,16.9
319,Other endovascular cardiac valve procedures with MCC,1.7606,36.6,30.5
320,Other endovascular cardiac valve procedures without MCC,1.0691,26.0,21.7
326,"Stomach, esophageal and duodenal procedures with MCC",1.7606,36.6,30.5
327,"Stomach, esophageal and duodenal procedures with CC",1.0691,26.0,21.7
328,"Stomach, esophageal and duodenal procedures without
CC/MCC",0.5191,16.9,14.1
329,Major small and large bowel procedures with MCC,1.7606,36.6,30.5
330,Major small and large bowel procedures with CC,1.7606,36.6,30.5
331,Major small and large bowel procedures without CC/MCC,0.5191,16.9,14.1
332,Rectal resection with MCC,0.6144,18.9,15.8
333,Rectal resection with CC,0.6144,18.9,15.8
334,Rectal resection without CC/MCC,0.5191,16.9,14.1
335,Peritoneal adhesiolysis with MCC,1.7606,36.6,30.5
336,Peritoneal adhesiolysis with CC,0.6144,18.9,15.8
337,Peritoneal adhesiolysis without CC/MCC,0.5191,16.9,14.1
338,"Appendectomy with complicated principal diagnosis with
MCC",0.948,23.3,19.4
339,Appendectomy with complicated principal diagnosis with CC,0.6144,18.9,15.8
340,"Appendectomy with complicated principal diagnosis without
CC/MCC",0.5191,16.9,14.1
341,"Appendectomy without complicated principal diagnosis with
MCC",0.8438,23.5,19.6
342,"Appendectomy without complicated principal diagnosis with
CC",0.8438,23.5,19.6
343,"Appendectomy without complicated principal diagnosis
without CC/MCC",0.8438,23.5,19.6
344,Minor small and large bowel procedures with MCC,0.8438,23.5,19.6
345,Minor small and large bowel procedures with CC,0.6144,18.9,15.8
346,Minor small and large bowel procedures without CC/MCC,0.5191,16.9,14.1
347,Anal and stomal procedures with MCC,0.6144,18.9,15.8
348,Anal and stomal procedures with CC,0.6144,18.9,15.8
349,Anal and stomal procedures without CC/MCC,0.5191,16.9,14.1
350,Inguinal and femoral hernia procedures with MCC,0.948,23.3,19.4
351,Inguinal and femoral hernia procedures with CC,0.6144,18.9,15.8
352,Inguinal and femoral hernia procedures without CC/MCC,0.5191,16.9,14.1
353,Hernia procedures except inguinal and femoral with MCC,1.0691,26.0,21.7
354,Hernia procedures except inguinal and femoral with CC,0.6144,18.9,15.8
355,"Hernia procedures except inguinal and femoral without
CC/MCC",0.5191,16.9,14.1
356,Other digestive system O.R. procedures with MCC,1.6106,35.2,29.3
357,Other digestive system O.R. procedures with CC,0.8438,23.5,19.6
358,Other digestive system O.R. procedures without CC/MCC,0.8438,23.5,19.6
368,Major esophageal disorders with MCC,1.0691,26.0,21.7
369,Major esophageal disorders with CC,0.5191,16.9,14.1
370,Major esophageal disorders without CC/MCC,0.5191,16.9,14.1
371,"Major gastrointestinal disorders and peritoneal infections with
MCC",0.948,23.3,19.4
372,"Major gastrointestinal disorders and peritoneal infections with
CC",0.6144,18.9,15.8
373,"Major gastrointestinal disorders and peritoneal infections
without CC/MCC",0.5191,16.9,14.1
374,Digestive malignancy with MCC,1.0691,26.0,21.7
375,Digestive malignancy with CC,0.6431,19.4,16.2
376,Digestive malignancy without CC/MCC,0.6431,19.4,16.2
377,Gastrointestinal hemorrhage with MCC,0.8249,20.2,16.8
378,Gastrointestinal hemorrhage with CC,0.6431,19.4,16.2
379,Gastrointestinal hemorrhage without CC/MCC,0.6431,19.4,16.2
380,Complicated peptic ulcer with MCC,1.012,27.5,22.9
381,Complicated peptic ulcer with CC,1.012,27.5,22.9
382,Complicated peptic ulcer without CC/MCC,1.012,27.5,22.9
383,Uncomplicated peptic ulcer with MCC,0.5191,16.9,14.1
384,Uncomplicated peptic ulcer without MCC,0.5191,16.9,14.1
385,Inflammatory bowel disease with MCC,0.9174,23.2,19.3
386,Inflammatory bowel disease with CC,0.9174,23.2,19.3
387,Inflammatory bowel disease without CC/MCC,0.9174,23.2,19.3
388,Gastrointestinal obstruction with MCC,0.944,22.8,19.0
389,Gastrointestinal obstruction with CC,0.6986,20.6,17.2
390,Gastrointestinal obstruction without CC/MCC,0.6986,20.6,17.2
391,"Esophagitis, gastroenteritis and miscellaneous digestive
disorders with MCC",0.86,22.7,18.9
392,"Esophagitis, gastroenteritis and miscellaneous digestive
disorders without MCC",0.6401,19.5,16.3
393,Other digestive system diagnoses with MCC,1.1206,26.7,22.3
394,Other digestive system diagnoses with CC,0.8384,22.5,18.8
395,Other digestive system diagnoses without CC/MCC,0.8384,22.5,18.8
405,"Pancreas, liver and shunt procedures with MCC",1.7606,36.6,30.5
406,"Pancreas, liver and shunt procedures with CC",0.6431,19.4,16.2
407,"Pancreas, liver and shunt procedures without CC/MCC",0.6431,19.4,16.2
408,"Biliary tract procedures except only cholecystectomy with or
without C.D.E. with MCC",0.8438,23.5,19.6
409,"Biliary tract procedures except only cholecystectomy with or
without C.D.E. with CC",0.6431,19.4,16.2
410,"Biliary tract procedures except only cholecystectomy with or
without C.D.E. without CC/MCC",0.6431,19.4,16.2
411,Cholecystectomy with C.D.E. with MCC,0.8249,20.2,16.8
412,Cholecystectomy with C.D.E. with CC,0.6431,19.4,16.2
413,Cholecystectomy with C.D.E. without CC/MCC,0.6431,19.4,16.2
414,"Cholecystectomy except by laparoscope without C.D.E. with
MCC",0.6431,19.4,16.2
415,"Cholecystectomy except by laparoscope without C.D.E. with
CC",0.6431,19.4,16.2
416,"Cholecystectomy except by laparoscope without C.D.E.
without CC/MCC",0.6431,19.4,16.2
417,Laparoscopic cholecystectomy without C.D.E. with MCC,1.7606,36.6,30.5
418,Laparoscopic cholecystectomy without C.D.E. with CC,0.5191,16.9,14.1
419,"Laparoscopic cholecystectomy without C.D.E. without
CC/MCC",0.5191,16.9,14.1
420,Hepatobiliary diagnostic procedures with MCC,1.0691,26.0,21.7
421,Hepatobiliary diagnostic procedures with CC,1.0691,26.0,21.7
422,Hepatobiliary diagnostic procedures without CC/MCC,1.0691,26.0,21.7
423,Other hepatobiliary or pancreas O.R. procedures with MCC,1.7606,36.6,30.5
424,Other hepatobiliary or pancreas O.R. procedures with CC,0.5191,16.9,14.1
425,"Other hepatobiliary or pancreas O.R. procedures without
CC/MCC",0.5191,16.9,14.1
432,Cirrhosis and alcoholic hepatitis with MCC,0.8317,20.9,17.4
433,Cirrhosis and alcoholic hepatitis with CC,0.8317,20.9,17.4
434,Cirrhosis and alcoholic hepatitis without CC/MCC,0.8317,20.9,17.4
435,Malignancy of hepatobiliary system or pancreas with MCC,0.8438,23.5,19.6
436,Malignancy of hepatobiliary system or pancreas with CC,0.5191,16.9,14.1
437,"Malignancy of hepatobiliary system or pancreas without
CC/MCC",0.5191,16.9,14.1
438,Disorders of pancreas except malignancy with MCC,1.117,25.3,21.1
439,Disorders of pancreas except malignancy with CC,0.8438,23.5,19.6
440,Disorders of pancreas except malignancy without CC/MCC,0.5191,16.9,14.1
441,"Disorders of liver except malignancy, cirrhosis or alcoholic
hepatitis with MCC",0.8507,21.7,18.1
442,"Disorders of liver except malignancy, cirrhosis or alcoholic
hepatitis with CC",0.6431,19.4,16.2
443,"Disorders of liver except malignancy, cirrhosis or alcoholic
hepatitis without CC/MCC",0.5191,16.9,14.1
444,Disorders of the biliary tract with MCC,0.8141,22.3,18.6
445,Disorders of the biliary tract with CC,0.6186,20.2,16.8
446,Disorders of the biliary tract without CC/MCC,0.5191,16.9,14.1
453,Combined anterior and posterior spinal fusion with MCC,1.7606,36.6,30.5
454,Combined anterior and posterior spinal fusion with CC,0.8857,24.8,20.7
455,"Combined anterior and posterior spinal fusion without
CC/MCC",0.8857,24.8,20.7
